{
  "approval_evidence": {
    "approver_id": "responsible-operator",
    "bindings": {
      "command_set_sha256": "d38e625839f1836c5d25a07a9df788c9b22b305e41c4673f4caea2ee0ad37f9f",
      "contract_raw_sha256": "671d06959bd9f2f0df729b850a86d8fac6179b471b252ef0b89b14a277428c15",
      "policy_bundle_sha256": "5cdcdd72508f5bb886be37ad1a5754dc2a117b5ac64baaec99c2c6b45c2ad4ac",
      "repair_envelope_sha256": null,
      "runtime_sha256": "77be1538738850de8926874a1142b68f3055f35e2a7820d3f176d5905f16c775",
      "schema_bundle_sha256": "effe68dc6c101df2b9abf1ef4b87e30b5e5ab1c74921f2b879cd7a333460d3a2"
    },
    "channel_record_id": "codex-chat-run-20261017-128-metric-invariance_identity_r1",
    "channel_record_sha256": "f99f8fbf6bdc261a963d2ca10b4f8385edde1f3efadbe8ced4d7b7f9b3af0fe5",
    "evidence_id": "operator-start-run-20261017-128-metric-invariance_identity_r1",
    "experiment_id": "metric-invariance-128a-20261017_identity_r1",
    "expires_at": "2026-10-24T00:45:29.326017+00:00",
    "issued_at": "2026-10-17T00:45:29.326017+00:00",
    "run_id": "run-20261017-128-metric-invariance_identity_r1",
    "source_kind": "trusted_operator_record",
    "trusted_channel": "operator_console"
  },
  "checks": [
    {
      "check_id": "policy",
      "evidence_sha256": "1fefd80683e91d4178cc11bd530ebe4461ec6787cb3a5ced96bad9eb36d13b64",
      "observed_at": "2026-10-17T00:45:29.326017+00:00",
      "valid_until": "2026-10-24T00:45:29.326017+00:00",
      "verdict": "pass"
    },
    {
      "check_id": "provenance",
      "evidence_sha256": "1fefd80683e91d4178cc11bd530ebe4461ec6787cb3a5ced96bad9eb36d13b64",
      "observed_at": "2026-10-17T00:45:29.326017+00:00",
      "valid_until": "2026-10-24T00:45:29.326017+00:00",
      "verdict": "pass"
    },
    {
      "check_id": "storage",
      "evidence_sha256": "1fefd80683e91d4178cc11bd530ebe4461ec6787cb3a5ced96bad9eb36d13b64",
      "observed_at": "2026-10-17T00:45:29.326017+00:00",
      "valid_until": "2026-10-24T00:45:29.326017+00:00",
      "verdict": "pass"
    },
    {
      "check_id": "acceptance",
      "evidence_sha256": "e4af342fdbfa55a5f84099669bed6d197f6e23bfe28633677085a2c5e22758de",
      "observed_at": "2026-10-17T00:45:29.326017+00:00",
      "valid_until": "2026-10-24T00:45:29.326017+00:00",
      "verdict": "pass"
    },
    {
      "check_id": "queue",
      "evidence_sha256": "1fefd80683e91d4178cc11bd530ebe4461ec6787cb3a5ced96bad9eb36d13b64",
      "observed_at": "2026-10-17T00:45:29.326017+00:00",
      "valid_until": "2026-10-24T00:45:29.326017+00:00",
      "verdict": "pass"
    },
    {
      "check_id": "watcher",
      "evidence_sha256": "e4af342fdbfa55a5f84099669bed6d197f6e23bfe28633677085a2c5e22758de",
      "observed_at": "2026-10-17T00:45:29.326017+00:00",
      "valid_until": "2026-10-24T00:45:29.326017+00:00",
      "verdict": "pass"
    }
  ],
  "contract_raw_sha256": "671d06959bd9f2f0df729b850a86d8fac6179b471b252ef0b89b14a277428c15",
  "created_at": "2026-10-17T00:45:29.326017+00:00",
  "derived_verdict": "pass",
  "document_kind": "preflight_report",
  "experiment_id": "metric-invariance-128a-20261017_identity_r1",
  "run_id": "run-20261017-128-metric-invariance_identity_r1",
  "schema_bundle_id": "harn-schema-v1",
  "schema_version": "1.0.0",
  "storage": [
    {
      "free_bytes": 3261186543616,
      "hard_floor_bytes": 53687091200,
      "measured_at": "2026-10-17T00:45:29.326017+00:00",
      "path": "/mnt/seagate/kojiek_data/metric_invariance_128_20261017_identity_r1/a",
      "peak_additional_bytes": 2147483648,
      "recovery_reserve_bytes": 2147483648,
      "transient_bytes": 536870912,
      "verdict": "pass"
    },
    {
      "free_bytes": 63552372736,
      "hard_floor_bytes": 53687091200,
      "measured_at": "2026-10-17T00:45:29.326017+00:00",
      "path": "/home/kojiek/MeanAudio",
      "peak_additional_bytes": 6442450944,
      "recovery_reserve_bytes": 2147483648,
      "transient_bytes": 104857600,
      "verdict": "pass"
    }
  ]
}
