{
  "approval_evidence": {
    "approver_id": "responsible-operator",
    "bindings": {
      "command_set_sha256": "6ed0379736c940a7de2aaffa43fd591144ed417219fe49b235456abd61663495",
      "contract_raw_sha256": "dada32d1cfd436c4fcd6459f91b124ca73483c2e053d95b625c7a8c955296955",
      "policy_bundle_sha256": "5cdcdd72508f5bb886be37ad1a5754dc2a117b5ac64baaec99c2c6b45c2ad4ac",
      "repair_envelope_sha256": null,
      "runtime_sha256": "77be1538738850de8926874a1142b68f3055f35e2a7820d3f176d5905f16c775",
      "schema_bundle_sha256": "effe68dc6c101df2b9abf1ef4b87e30b5e5ab1c74921f2b879cd7a333460d3a2"
    },
    "channel_record_id": "codex-chat-20261017-start-128",
    "channel_record_sha256": "44a1f6f736b227f58aa282d8f64794769bc372ac8282cd1f1d96942da5bb7b01",
    "evidence_id": "operator-start-128-20261017",
    "experiment_id": "metric-invariance-128c-20261017",
    "expires_at": "2026-10-23T18:09:36.266168+00:00",
    "issued_at": "2026-10-16T18:09:36.266168+00:00",
    "run_id": "run-20261017-130-metric-invariance",
    "source_kind": "trusted_operator_record",
    "trusted_channel": "operator_console"
  },
  "checks": [
    {
      "check_id": "policy",
      "evidence_sha256": "8ea78107e8ea65fdeb7b2e5744ee854be3274f4d97395a6719955bfb8a88971a",
      "observed_at": "2026-10-16T18:09:36.266168+00:00",
      "valid_until": "2026-10-23T18:09:36.266168+00:00",
      "verdict": "pass"
    },
    {
      "check_id": "provenance",
      "evidence_sha256": "8ea78107e8ea65fdeb7b2e5744ee854be3274f4d97395a6719955bfb8a88971a",
      "observed_at": "2026-10-16T18:09:36.266168+00:00",
      "valid_until": "2026-10-23T18:09:36.266168+00:00",
      "verdict": "pass"
    },
    {
      "check_id": "storage",
      "evidence_sha256": "8ea78107e8ea65fdeb7b2e5744ee854be3274f4d97395a6719955bfb8a88971a",
      "observed_at": "2026-10-16T18:09:36.266168+00:00",
      "valid_until": "2026-10-23T18:09:36.266168+00:00",
      "verdict": "pass"
    },
    {
      "check_id": "acceptance",
      "evidence_sha256": "cdc66c94fb3a66cf2dffd50b9b46250197b741246848dc0b647d2d4b2ae15b38",
      "observed_at": "2026-10-16T18:09:36.266168+00:00",
      "valid_until": "2026-10-23T18:09:36.266168+00:00",
      "verdict": "pass"
    },
    {
      "check_id": "queue",
      "evidence_sha256": "8ea78107e8ea65fdeb7b2e5744ee854be3274f4d97395a6719955bfb8a88971a",
      "observed_at": "2026-10-16T18:09:36.266168+00:00",
      "valid_until": "2026-10-23T18:09:36.266168+00:00",
      "verdict": "pass"
    },
    {
      "check_id": "watcher",
      "evidence_sha256": "cdc66c94fb3a66cf2dffd50b9b46250197b741246848dc0b647d2d4b2ae15b38",
      "observed_at": "2026-10-16T18:09:36.266168+00:00",
      "valid_until": "2026-10-23T18:09:36.266168+00:00",
      "verdict": "pass"
    }
  ],
  "contract_raw_sha256": "dada32d1cfd436c4fcd6459f91b124ca73483c2e053d95b625c7a8c955296955",
  "created_at": "2026-10-16T18:09:36.266168+00:00",
  "derived_verdict": "pass",
  "document_kind": "preflight_report",
  "experiment_id": "metric-invariance-128c-20261017",
  "run_id": "run-20261017-130-metric-invariance",
  "schema_bundle_id": "harn-schema-v1",
  "schema_version": "1.0.0",
  "storage": [
    {
      "free_bytes": 3261204066304,
      "hard_floor_bytes": 53687091200,
      "measured_at": "2026-10-16T18:09:36.266168+00:00",
      "path": "/mnt/seagate/kojiek_data/metric_invariance_128_20261017/c",
      "peak_additional_bytes": 2147483648,
      "recovery_reserve_bytes": 2147483648,
      "transient_bytes": 536870912,
      "verdict": "pass"
    },
    {
      "free_bytes": 68725288960,
      "hard_floor_bytes": 53687091200,
      "measured_at": "2026-10-16T18:09:36.266168+00:00",
      "path": "/home/kojiek/MeanAudio",
      "peak_additional_bytes": 6442450944,
      "recovery_reserve_bytes": 2147483648,
      "transient_bytes": 104857600,
      "verdict": "pass"
    }
  ]
}
