{
  "document_kind": "preflight_report",
  "schema_version": "1.0.0",
  "schema_bundle_id": "harn-schema-v1",
  "experiment_id": "aes-negmf-fp32-diagnostic-20261003",
  "run_id": "run-20261003-100",
  "contract_raw_sha256": "209ccfbe5c0594b1ff32628f972add83f34344d6cf28d151975232835ec7cf1e",
  "approval_evidence": {
    "evidence_id": "operator-diagnosis-100",
    "source_kind": "trusted_operator_record",
    "trusted_channel": "operator_console",
    "channel_record_id": "codex-user-diagnose-failed-rerun",
    "channel_record_sha256": "9e64e13b16a353f4a1283846ce0b8e26b18bf386b3ceb32b5d04f99b134a61f7",
    "approver_id": "responsible-operator",
    "issued_at": "2026-10-03T12:52:45.617926+00:00",
    "expires_at": "2026-10-10T12:52:45.617934+00:00",
    "experiment_id": "aes-negmf-fp32-diagnostic-20261003",
    "run_id": "run-20261003-100",
    "bindings": {
      "contract_raw_sha256": "209ccfbe5c0594b1ff32628f972add83f34344d6cf28d151975232835ec7cf1e",
      "policy_bundle_sha256": "5cdcdd72508f5bb886be37ad1a5754dc2a117b5ac64baaec99c2c6b45c2ad4ac",
      "schema_bundle_sha256": "effe68dc6c101df2b9abf1ef4b87e30b5e5ab1c74921f2b879cd7a333460d3a2",
      "runtime_sha256": "a9bfbdc4e08f0592136130d61aab617ec84d671bbd34392e4a3a4edca427565e",
      "repair_envelope_sha256": null,
      "command_set_sha256": "e17eaaf8e02103f8703c30da9e4ec3f43855f02c5d8c615ba0281414f6d8c0d7"
    }
  },
  "checks": [
    {
      "check_id": "policy",
      "verdict": "pass",
      "observed_at": "2026-10-03T12:52:45.617926+00:00",
      "valid_until": "2026-10-10T12:52:45.617934+00:00",
      "evidence_sha256": "a6ce339ed14a54fd3920bba0a503ae51bc85718b0cee9fafd20410e999934a0e"
    },
    {
      "check_id": "provenance",
      "verdict": "pass",
      "observed_at": "2026-10-03T12:52:45.617926+00:00",
      "valid_until": "2026-10-10T12:52:45.617934+00:00",
      "evidence_sha256": "a6ce339ed14a54fd3920bba0a503ae51bc85718b0cee9fafd20410e999934a0e"
    },
    {
      "check_id": "storage",
      "verdict": "pass",
      "observed_at": "2026-10-03T12:52:45.617926+00:00",
      "valid_until": "2026-10-10T12:52:45.617934+00:00",
      "evidence_sha256": "a6ce339ed14a54fd3920bba0a503ae51bc85718b0cee9fafd20410e999934a0e"
    },
    {
      "check_id": "notification",
      "verdict": "pass",
      "observed_at": "2026-10-03T12:52:45.617926+00:00",
      "valid_until": "2026-10-10T12:52:45.617934+00:00",
      "evidence_sha256": "a6ce339ed14a54fd3920bba0a503ae51bc85718b0cee9fafd20410e999934a0e"
    },
    {
      "check_id": "queue",
      "verdict": "pass",
      "observed_at": "2026-10-03T12:52:45.617926+00:00",
      "valid_until": "2026-10-10T12:52:45.617934+00:00",
      "evidence_sha256": "a6ce339ed14a54fd3920bba0a503ae51bc85718b0cee9fafd20410e999934a0e"
    },
    {
      "check_id": "watcher",
      "verdict": "pass",
      "observed_at": "2026-10-03T12:52:45.617926+00:00",
      "valid_until": "2026-10-10T12:52:45.617934+00:00",
      "evidence_sha256": "a6ce339ed14a54fd3920bba0a503ae51bc85718b0cee9fafd20410e999934a0e"
    },
    {
      "check_id": "acceptance",
      "verdict": "pass",
      "observed_at": "2026-10-03T12:52:45.617926+00:00",
      "valid_until": "2026-10-10T12:52:45.617934+00:00",
      "evidence_sha256": "a6ce339ed14a54fd3920bba0a503ae51bc85718b0cee9fafd20410e999934a0e"
    }
  ],
  "storage": [
    {
      "path": "/home/kojiek/MeanAudio",
      "hard_floor_bytes": 80000000000,
      "peak_additional_bytes": 100000000,
      "transient_bytes": 50000000,
      "recovery_reserve_bytes": 80000000000,
      "measured_at": "2026-10-03T12:52:45.617926+00:00",
      "free_bytes": 287316131840,
      "verdict": "pass"
    },
    {
      "path": "/home/kojiek/logs",
      "hard_floor_bytes": 80000000000,
      "peak_additional_bytes": 100000000,
      "transient_bytes": 50000000,
      "recovery_reserve_bytes": 80000000000,
      "measured_at": "2026-10-03T12:52:45.617926+00:00",
      "free_bytes": 287316131840,
      "verdict": "pass"
    },
    {
      "path": "/home/kojiek/gpu_queue/notification_receipts",
      "hard_floor_bytes": 80000000000,
      "peak_additional_bytes": 100000000,
      "transient_bytes": 50000000,
      "recovery_reserve_bytes": 80000000000,
      "measured_at": "2026-10-03T12:52:45.617926+00:00",
      "free_bytes": 287316131840,
      "verdict": "pass"
    }
  ],
  "derived_verdict": "pass",
  "created_at": "2026-10-03T12:52:45.617926+00:00"
}
